home_team,away_team,game_date,result,home_goals,away_goals,referee,attendance,venue,home_ball_possession,away_ball_possession,home_goal_attempts,away_goal_attempts,home_shots_on_goal,away_shots_on_goal,home_shots_off_goal,away_shots_off_goal,home_blocked_shots,away_blocked_shots,home_free_kicks,away_free_kicks,home_corner_kicks,away_corner_kicks,home_offsides,away_offsides,home_goalkeeper_saves,away_goalkeeper_saves,home_fouls,away_fouls,home_yellow_cards,away_yellow_cards,home_formation,away_formation,home_players,away_players,home_substitutes,away_substitutes,substitutions_made,home_coach,away_coach
West Ham,Middlesbrough,10/1/2016,D,1,1,Swarbrick N. (Eng),56945,Olympic Stadium (London),0.4,0.6,19,9,2,3,11,4,6,2,14,18,4,5,5,2,2,1,13,12,2,3,4 - 3 - 3,4 - 2 - 3 - 1,"[u'Adrian ', u'Antonio M.', u'Byram S.', u'Collins J.', u'Kouyate C.', u'Noble M. ', u'Obiang P.', u'Ogbonna A.', u'Payet D.', u'Reid W.', u'Tore G.']","[u'Barragan A.', u'Chambers C.', u'De Roon M.', u'Downing S.', u'Fischer V.', u'Forshaw A.', u'Friend G. ', u'Gibson B.', u'Rhodes J.', u'Stuani C.', u'Valdes V. ']","[u'Arbeloa A.', u'Feghouli S.', u'Fernandes E.', u'Fletcher A.', u'Lanzini M.', u'Randolph D. ', u'Zaza S.']","[u'Ayala D.', u'Clayton A.', u'Espinosa B.', u'Guzan B. ', u'Negredo A.', u'Ramirez G.', u'Traore A.']","[(u'Arbeloa A.', u'Byram S.'), (u'Lanzini M.', u'Noble M.'), (u'Negredo A.', u'Rhodes J.'), (u'Ramirez G.', u'Fischer V.'), (u'Zaza S.', u'Tore G.')]",Bilic S.,Karanka A.
Manchester United,Arsenal,11/19/2016,D,1,1,Marriner A. (Eng),75264,Old Trafford (Manchester),0.45,0.55,12,5,5,1,5,3,2,1,10,18,10,4,3,0,0,4,14,11,3,3,4 - 2 - 3 - 1,4 - 2 - 3 - 1,"[u'Carrick M. ', u'Darmian M.', u'de Gea D. ', u'Herrera A.', u'Jones P.', u'Martial A.', u'Mata', u'Pogba P.', u'Rashford M.', u'Rojo M.', u'Valencia A.']","[u'Cech P. ', u'Coquelin F.', u'Elneny M.', u'Jenkinson C.', u'Koscielny L. ', u'Monreal N.', u'Mustafi S.', u'Ozil M.', u'Ramsey A.', u'Sanchez A.', u'Walcott T.']","[u'Blind D.', u'Depay M.', u'Lingard J.', u'Romero S. ', u'Rooney W.', u'Schneiderlin M.', u'Young A.']","[u'Gibbs K.', u'Giroud O.', u'Iwobi A.', u'Ospina D. ', u'Oxlade-Chamberlain A.', u'Gabriel', u'Xhaka G.']","[(u'Blind D.', u'Darmian M.'), (u'Giroud O.', u'Elneny M.'), (u'Rooney W.', u'Martial A.'), (u'Oxlade-Chamberlain A.', u'Jenkinson C.'), (u'Schneiderlin M.', u'Mata J.'), (u'Xhaka G.', u'Coquelin F.')]",Mourinho J.,Wenger A.
Manchester City,Sunderland,8/13/2016,W,2,1,Madley R. (Eng),54362,Etihad Stadium (Manchester),0.77,0.23,16,7,4,3,8,2,4,2,14,12,9,6,1,2,2,2,11,14,1,2,4 - 2 - 3 - 1,4 - 2 - 3 - 1,"[u'Aguero S.', u'Caballero W. ', u'Clichy G.', u'de Bruyne K.', u'Fernandinho', u'Kolarov A.', u'Nolito D.', u'Sagna B.', u'Silva D. ', u'Sterling R.', u'Stones J.']","[u'Borini F.', u'Defoe J.', u'Gooch L.', u'Kaboul Y.', u'Kone L.', u'Love D.', u'Mannone V. ', u""O'Shea J. "", u'Rodwell J.', u'van Aanholt P.', u'Watmore D.']","[u'Delph F.', u'Hart J. ', u'Iheanacho K.', u'Navas J.', u'Otamendi N.', u'Fernando', u'Zabaleta P.']","[u'Asoro J.', u'Djilobodji P.', u'Januzaj A.', u'Khazri W.', u'Lens J.', u'McNair P.', u'Pickford J. ']","[(u'Delph F.', u'Silva D.'), (u'Iheanacho K.', u'Clichy G.'), (u'Januzaj A.', u'Watmore D.'), (u'Navas J.', u'Nolito D.'), (u'Khazri W.', u'Gooch L.'), (u'McNair P.', u'Defoe J.)(Own goal')]",Guardiola P.,Moyes D.
Liverpool,Manchester United,10/17/2016,D,0,0,Taylor A. (Eng),52769,Anfield Road (Liverpool),0.65,0.35,9,7,3,1,3,5,3,1,25,16,3,1,2,5,1,3,14,20,0,4,4 - 3 - 3,4 - 2 - 3 - 1,"[u'Can E.', u'Clyne N.', u'Coutinho', u'Firmino R.', u'Henderson J. ', u'Karius L. ', u'Lovren D.', u'Mane S.', u'Matip J.', u'Milner J.', u'Sturridge D.']","[u'Bailly E.', u'Blind D.', u'de Gea D. ', u'Fellaini M.', u'Herrera A.', u'Ibrahimovic Z.', u'Pogba P.', u'Rashford M.', u'Smalling C. ', u'Valencia A.', u'Young A.']","[u'Grujic M.', u'Klavan R.', u'Lallana A.', u'Mignolet S. ', u'Moreno A.', u'Origi D.', u'Lucas Leiva']","[u'Carrick M.', u'Lingard J.', u'Mata', u'Rojo M.', u'Romero S. ', u'Rooney W.', u'Shaw L.']","[(u'Lallana A.', u'Sturridge D.'), (u'Moreno A.', u'Milner J.'), (u'Origi D.', u'Firmino R.'), (u'Rooney W.', u'Rashford M.'), (u'Shaw L.', u'Young A.')]",Klopp J.,Mourinho J.
Arsenal,Middlesbrough,10/22/2016,D,0,0,Dean M. (Eng),59962,Emirates Stadium (London),0.75,0.25,9,11,5,4,3,3,1,4,15,11,8,3,5,2,4,5,6,13,1,0,4 - 2 - 3 - 1,4 - 3 - 2 - 1,"[u'Bellerin H.', u'Cech P. ', u'Coquelin F.', u'Elneny M.', u'Iwobi A.', u'Koscielny L. ', u'Monreal N.', u'Mustafi S.', u'Ozil M.', u'Sanchez A.', u'Walcott T.']","[u'Ayala D.', u'Barragan A.', u'Clayton A.', u'De Roon M.', u'Forshaw A.', u'Friend G. ', u'Gibson B.', u'Negredo A.', u'Ramirez G.', u'Traore A.', u'Valdes V. ']","[u'Gibbs K.', u'Maitland-Niles A.', u'Ospina D. ', u'Oxlade-Chamberlain A.', u'Gabriel', u'Perez L.', u'Reine Adelaide J.']","[u'De Sart J.', u'Downing S.', u'Espinosa B.', u'Guzan B. ', u'Nugent D.', u'Fabio', u'Stuani C.']","[(u'Downing S.', u'Ramirez G.'), (u'Oxlade-Chamberlain A.', u'Elneny M.'), (u'Perez L.', u'Iwobi A.'), (u'Stuani C.', u'Negredo A.')]",Wenger A.,Karanka A.
Crystal Palace,Bournemouth,8/27/2016,D,1,1,Dean M. (Eng),23503,Selhurst Park (London),0.59,0.41,24,10,5,3,12,4,7,3,12,19,10,4,5,2,2,4,15,10,2,1,4 - 4 - 1 - 1,4 - 3 - 3,"[u'Benteke C.', u'Cabaye Y.', u'Dann S. ', u'Delaney D.', u'Mandanda S. ', u'McArthur J.', u'Puncheon J.', u'Souare P.', u'Townsend A.', u'Ward J.', u'Wickham C.']","[u'Arter H.', u'Boruc A. ', u'Cook S.', u'Daniels C.', u'Francis S. ', u'Fraser R.', u'Ibe J.', u'King J.', u'Smith A.', u'Surman A.', u'Wilson C.']","[u'Boateng H.', u'Kelly M.', u'Ledley J.', u'Lee Chung-Yong', u'Speroni J. ', u'Tomkins J.', u'Zaha W.']","[u'Afobe B.', u'Ake N.', u'Federici A. ', u'Gosling D.', u'Grabban L.', u'Gradel M.', u'Smith B.']","[(u'Kelly M.', u'Ward J.'), (u'Ake N.', u'Fraser R.'), (u'Lee Chung-Yong', u'McArthur J.'), (u'Gosling D.', u'Ibe J.'), (u'Grabban L.', u'Wilson C.'), (u'Zaha W.', u'Wickham C.')]",Pardew A.,Howe E.
Arsenal,Chelsea,9/24/2016,W,3,0,Oliver M. (Eng),60028,Emirates Stadium (London),0.5,0.5,14,9,5,2,5,5,4,2,13,14,9,1,5,2,2,2,9,11,0,2,4 - 2 - 3 - 1,4 - 1 - 4 - 1,"[u'Bellerin H.', u'Cazorla S.', u'Cech P. ', u'Coquelin F.', u'Iwobi A.', u'Koscielny L. ', u'Monreal N.', u'Mustafi S.', u'Ozil M.', u'Sanchez A.', u'Walcott T.']","[u'Azpilicueta C.', u'Cahill G.', u'Costa D.', u'Courtois T. ', u'Fabregas C.', u'Hazard E.', u'Ivanovic B. ', u'Kante N.', u'Luiz D.', u'Matic N.', u'Willian']","[u'Gibbs K.', u'Giroud O.', u'Holding R.', u'Ospina D. ', u'Oxlade-Chamberlain A.', u'Perez L.', u'Xhaka G.']","[u'Alonso M.', u'Batshuayi M.', u'Begovic A. ', u'Chalobah N.', u'Moses V.', u'Oscar', u'Pedro']","[(u'Gibbs K.', u'Iwobi A.'), (u'Alonso M.', u'Fabregas C.'), (u'Giroud O.', u'Sanchez A.'), (u'Batshuayi M.', u'Hazard E.'), (u'Xhaka G.', u'Coquelin F.'), (u'Pedro', u'Willian')]",Wenger A.,Conte A.
Tottenham,Leicester,10/29/2016,D,1,1,Madley R. (Eng),31868,White Hart Lane (London),0.64,0.36,22,6,5,1,11,4,6,1,19,13,8,1,2,1,0,4,11,20,3,4,4 - 2 - 3 - 1,4 - 4 - 2,"[u'Alli D.', u'Dembele M.', u'Dier E.', u'Eriksen C.', u'Janssen V.', u'Lloris H. ', u'Rose D.', u'Son Heung-Min', u'Vertonghen J.', u'Walker K.', u'Wanyama V.']","[u'Drinkwater D.', u'Fuchs Ch.', u'Huth R.', u'King A.', u'Mahrez R.', u'Morgan W. ', u'Musa A.', u'Okazaki S.', u'Schmeichel K. ', u'Simpson D.', u'Vardy J.']","[u'Carter-Vickers C.', u'Davies B.', u""N'Koudou G."", u'Onomah J.', u'Trippier K.', u'Vorm M. ', u'Winks H.']","[u'Albrighton M.', u'Amartey D.', u'Gray D.', u'Hernandez L.', u'Schlupp J.', u'Ulloa L.', u'Zieler R. ']","[(u'Albrighton M.', u'Mahrez R.'), (u""N'Koudou G."", u'Alli D.'), (u'Schlupp J.', u'Musa A.'), (u'Ulloa L.', u'Okazaki S.'), (u'Winks H.', u'Wanyama V.')]",Pochettino M.,Ranieri C.
Arsenal,Swansea,10/15/2016,W,3,2,Moss J. (Eng),60007,Emirates Stadium (London),0.49,0.51,16,13,6,6,7,5,3,2,12,16,5,6,9,2,4,3,7,10,0,1,4 - 2 - 3 - 1,4 - 4 - 1 - 1,"[u'Bellerin H.', u'Cazorla S.', u'Cech P. ', u'Iwobi A.', u'Koscielny L. ', u'Monreal N.', u'Mustafi S.', u'Ozil M.', u'Sanchez A.', u'Walcott T.', u'Xhaka G.']","[u'Amat J.', u'Barrow M.', u'Britton L. ', u'Cork J.', u'Fabianski L. ', u'Fer L.', u'Fernandez F.', u'Naughton K.', u'Routledge W.', u'Sigurdsson G.', u'Taylor N.']","[u'Coquelin F.', u'Elneny M.', u'Gibbs K.', u'Ospina D. ', u'Oxlade-Chamberlain A.', u'Gabriel', u'Perez L.']","[u'Baston B.', u'Fulton J.', u'Ki Sung-Yong', u'Kingsley S.', u'Nordfeldt K. ', u'Rangel A.', u'van der Hoorn M.']","[(u'Coquelin F.', u'Iwobi A.'), (u'Baston B.', u'Britton L.'), (u'Gibbs K.', u'Ozil M.'), (u'Ki Sung-Yong', u'Cork J.'), (u'Oxlade-Chamberlain A.', u'Sanchez A.'), (u'Rangel A.', u'Barrow M.')]",Wenger A.,Bradley B.
Arsenal,Liverpool,8/14/2016,L,3,4,Oliver M. (Eng),60033,Emirates Stadium (London),0.51,0.49,9,16,5,7,3,3,1,6,20,17,5,4,4,3,3,2,13,17,3,3,4 - 2 - 3 - 1,4 - 3 - 3,"[u'Bellerin H.', u'Cech P. ', u'Chambers C.', u'Coquelin F.', u'Elneny M.', u'Holding R.', u'Iwobi A.', u'Monreal N.', u'Ramsey A.', u'Sanchez A.', u'Walcott T.']","[u'Clyne N.', u'Coutinho', u'Firmino R.', u'Henderson J. ', u'Klavan R.', u'Lallana A.', u'Lovren D.', u'Mane S.', u'Mignolet S. ', u'Moreno A.', u'Wijnaldum G.']","[u'Akpom Ch.', u'Cazorla S.', u'Gibbs K.', u'Ospina D. ', u'Oxlade-Chamberlain A.', u'Wilshere J.', u'Xhaka G.']","[u'Alexander-Arnold T.', u'Can E.', u'Grujic M.', u'Manninger A. ', u'Matip J.', u'Origi D.', u'Stewart K.']","[(u'Cazorla S.', u'Ramsey A.'), (u'Can E.', u'Coutinho'), (u'Oxlade-Chamberlain A.', u'Iwobi A.'), (u'Origi D.', u'Lallana A.'), (u'Xhaka G.', u'Elneny M.'), (u'Stewart K.', u'Wijnaldum G.')]",Wenger A.,Klopp J.
Arsenal,Bournemouth,11/27/2016,W,3,1,Jones M. (Eng),59978,Emirates Stadium (London),0.52,0.48,16,9,3,3,7,5,6,1,17,12,3,10,1,4,2,0,12,13,3,5,4 - 2 - 3 - 1,4 - 2 - 3 - 1,"[u'Cech P. ', u'Debuchy M.', u'Elneny M.', u'Koscielny L. ', u'Monreal N.', u'Mustafi S.', u'Oxlade-Chamberlain A.', u'Ozil M.', u'Sanchez A.', u'Walcott T.', u'Xhaka G.']","[u'Ake N.', u'Arter H.', u'Cook S.', u'Federici A. ', u'Francis S. ', u'Gosling D.', u'King J.', u'Smith A.', u'Smith B.', u'Stanislas J.', u'Wilson C.']","[u'Coquelin F.', u'Gibbs K.', u'Giroud O.', u'Iwobi A.', u'Ospina D. ', u'Gabriel', u'Ramsey A.']","[u'Afobe B.', u'Allsop R. ', u'Fraser R.', u'Ibe J.', u'Mings T.', u'Mousset L.', u'Pugh M.']","[(u'Afobe B.', u'Wilson C.'), (u'Giroud O.', u'Walcott T.'), (u'Ibe J.', u'Stanislas J.'), (u'Gabriel', u'Debuchy M.'), (u'Mousset L.', u'Smith B.'), (u'Ramsey A.', u'Oxlade-Chamberlain A.')]",Wenger A.,Howe E.
Manchester City,Middlesbrough,11/5/2016,D,1,1,Friend K. (Eng),54294,Etihad Stadium (Manchester),0.71,0.29,25,5,7,3,11,1,7,1,17,11,8,2,5,2,2,6,7,15,1,3,4 - 1 - 4 - 1,4 - 5 - 1,"[u'Aguero S.', u'Bravo C. ', u'Clichy G.', u'de Bruyne K.', u'Fernandinho', u'Gundogan I.', u'Kolarov A.', u'Navas J.', u'Silva D.', u'Stones J.', u'Zabaleta P. ']","[u'Barragan A.', u'Chambers C.', u'Clayton A.', u'De Roon M.', u'Downing S.', u'Forshaw A.', u'Friend G. ', u'Gibson B.', u'Negredo A.', u'Traore A.', u'Valdes V. ']","[u'Caballero W. ', u'Garcia A.', u'Iheanacho K.', u'Kompany V.', u'Maffeo P.', u'Nolito D.', u'Sane L.']","[u'Espinosa B.', u'Fischer V.', u'Guzan B. ', u'Leadbitter G.', u'Nugent D.', u'Fabio', u'Stuani C.']","[(u'Garcia A.', u'Navas J.'), (u'Fischer V.', u'Downing S.'), (u'Iheanacho K.', u'Aguero S.'), (u'Nolito D.', u'Gundogan I.'), (u'Stuani C.', u'Traore A.')]",Guardiola P.,Karanka A.
Sunderland,West Brom,10/1/2016,D,1,1,Attwell S. (Eng),40043,Stadium of Light (Sunderland),0.56,0.44,7,17,2,7,4,7,1,3,14,8,6,5,2,1,6,1,7,13,1,3,4 - 1 - 4 - 1,4 - 4 - 1 - 1,"[u'Defoe J.', u'Denayer J.', u'Khazri W.', u'Kirchhoff J.', u'Kone L.', u'Manquillo J.', u'McNair P.', u'Ndong D.', u""O'Shea J. "", u'Pickford J. ', u'Watmore D.']","[u'Chadli N.', u'Dawson C.', u'Evans J.', u'Fletcher D. ', u'Foster B. ', u'McAuley G.', u'McClean J.', u'Nyom A.', u'Phillips M.', u'Rondon S.', u'Yacob C.']","[u'Djilobodji P.', u'Gooch L.', u'Honeyman G.', u'Love D.', u'Mika ', u'Rodwell J.', u'van Aanholt P.']","[u'Berahino S.', u'Gardner C.', u'Leko J.', u'Morrison J.', u'Myhill B. ', u'Olsson J.', u'Robson-Kanu H.']","[(u'Gooch L.', u'Khazri W.'), (u'Gardner C.', u'McClean J.'), (u'Morrison J.', u'Chadli N.'), (u'Rodwell J.', u'McNair P.'), (u'van Aanholt P.', u'Kirchhoff J.'), (u'Robson-Kanu H.', u'Rondon S.')]",Moyes D.,Pulis T.
Burnley,Everton,10/22/2016,W,2,1,Jones M. (Eng),21416,Turf Moor (Burnley),0.34,0.66,9,20,3,8,4,2,2,10,15,17,2,8,1,1,7,1,16,15,2,3,4 - 4 - 1 - 1,4 - 3 - 3,"[u'Arfield S.', u'Gudmundsson J.', u'Heaton T. ', u'Hendrick J.', u'Keane M.', u'Kightly M.', u'Lowton M.', u'Marney D.', u'Mee B.', u'Vokes S.', u'Ward S.']","[u'Barkley R.', u'Barry G.', u'Bolasie Y.', u'Coleman S.', u'Gueye I.', u'Jagielka P. ', u'Lukaku R.', u'Mirallas K.', u'Oviedo B.', u'Stekelenburg M. ', u'Williams A.']","[u'Bamford P.', u'Darikwa T.', u'Flanagan J.', u'Long K.', u""O'Neill A."", u'Robinson P. ', u'Tarkowski J.']","[u'Cleverley T.', u'Deulofeu G.', u'Holgate M.', u'Lennon A.', u'Mori R.', u'Robles J. ', u'Valencia E.']","[(u'Bamford P.', u'Vokes S.'), (u'Cleverley T.', u'Gueye I.'), (u'Deulofeu G.', u'Mirallas K.'), (u'Flanagan J.', u'Ward S.'), (u'Tarkowski J.', u'Kightly M.'), (u'Valencia E.', u'Jagielka P.')]",Dyche S.,Koeman R.
West Brom,Everton,8/20/2016,L,1,2,Swarbrick N. (Eng),23654,The Hawthorns (West Bromwich),0.34,0.66,11,13,4,7,5,5,2,1,11,16,7,4,0,1,5,3,16,10,3,1,4 - 4 - 2,3 - 4 - 2 - 1,"[u'Berahino S.', u'Dawson C.', u'Evans J.', u'Fletcher D. ', u'Foster B. ', u'Gardner C.', u'McAuley G.', u'Olsson J.', u'Phillips M.', u'Rondon S.', u'Yacob C.']","[u'Baines L.', u'Barkley R.', u'Barry G.', u'Deulofeu G.', u'Gueye I.', u'Holgate M.', u'Jagielka P. ', u'McCarthy J.', u'Mirallas K.', u'Mori R.', u'Stekelenburg M. ']","[u'Field S.', u'Lambert R.', u'Leko J.', u'McClean J.', u'Morrison J.', u'Myhill B. ', u'Wilson K.']","[u'Bolasie Y.', u'Cleverley T.', u'Lennon A.', u'Lukaku R.', u'Oviedo B.', u'Robles J. ', u'Williams A.']","[(u'Bolasie Y.', u'Deulofeu G.'), (u'Lambert R.', u'Berahino S.'), (u'Leko J.', u'Phillips M.'), (u'McClean J.', u'Gardner C.'), (u'Lukaku R.', u'McCarthy J.'), (u'Williams A.', u'Mirallas K.')]",Pulis T.,Koeman R.
Hull City,Chelsea,10/1/2016,L,0,2,Taylor A. (Eng),21257,KC Stadium (Hull),0.4,0.6,8,22,3,9,2,9,3,4,15,14,5,7,1,0,7,3,13,15,2,2,4 - 5 - 1,3 - 4 - 3,"[u'Clucas S.', u'Davies C. ', u'Diomande A.', u'Henriksen M.', u'Livermore J.', u'Marshall D. ', u'Mason R.', u'Mbokani D.', u'Meyler D.', u'Robertson A.', u'Snodgrass R.']","[u'Alonso M.', u'Azpilicueta C.', u'Cahill G. ', u'Costa D.', u'Courtois T. ', u'Hazard E.', u'Kante N.', u'Luiz D.', u'Matic N.', u'Moses V.', u'Willian']","[u'Hernandez A.', u'Huddlestone T.', u'Jakupovic E. ', u'Keane W.', u'Maguire H.', u'Maloney S.', u'Weir J.']","[u'Batshuayi M.', u'Begovic A. ', u'Chalobah N.', u'Fabregas C.', u'Ivanovic B.', u'Oscar', u'Pedro']","[(u'Hernandez A.', u'Henriksen M.'), (u'Huddlestone T.', u'Clucas S.'), (u'Chalobah N.', u'Willian'), (u'Maloney S.', u'Diomande A.'), (u'Oscar', u'Hazard E.'), (u'Pedro', u'Moses V.')]",Phelan M.,Conte A.
Everton,West Ham,10/30/2016,W,2,0,Taylor A. (Eng),39574,Goodison Park (Liverpool),0.49,0.51,17,13,6,3,4,4,7,6,13,18,8,8,2,1,3,4,15,12,2,3,4 - 3 - 3,3 - 4 - 2 - 1,"[u'Barkley R.', u'Barry G. ', u'Bolasie Y.', u'Coleman S.', u'Gueye I.', u'Lukaku R.', u'Mirallas K.', u'Mori R.', u'Oviedo B.', u'Robles J. ', u'Williams A.']","[u'Adrian ', u'Antonio M.', u'Cresswell A.', u'Fernandes E.', u'Kouyate C.', u'Lanzini M.', u'Noble M. ', u'Obiang P.', u'Ogbonna A.', u'Payet D.', u'Reid W.']","[u'Calvert-Lewin D.', u'Cleverley T.', u'Deulofeu G.', u'Hewelt M. ', u'Holgate M.', u'Jagielka P.', u'Lennon A.']","[u'Ayew A.', u'Collins J.', u'Feghouli S.', u'Fletcher A.', u'Nordtveit H.', u'Randolph D. ', u'Zaza S.']","[(u'Ayew A.', u'Obiang P.'), (u'Cleverley T.', u'Mirallas K.'), (u'Feghouli S.', u'Lanzini M.'), (u'Jagielka P.', u'Bolasie Y.'), (u'Lennon A.', u'Barkley R.'), (u'Zaza S.', u'Fernandes E.')]",Koeman R.,Bilic S.
Manchester City,Bournemouth,9/17/2016,W,4,0,Moss J. (Eng),54335,Etihad Stadium (Manchester),0.64,0.36,20,6,12,2,3,3,5,1,13,10,5,5,1,2,2,8,8,11,1,1,4 - 2 - 3 - 1,4 - 5 - 1,"[u'Bravo C. ', u'Clichy G.', u'de Bruyne K.', u'Fernandinho ', u'Gundogan I.', u'Iheanacho K.', u'Kolarov A.', u'Nolito D.', u'Otamendi N.', u'Sagna B.', u'Sterling R.']","[u'Arter H.', u'Boruc A. ', u'Cook S.', u'Daniels C.', u'Francis S. ', u'Ibe J.', u'King J.', u'Smith A.', u'Stanislas J.', u'Surman A.', u'Wilshere J.']","[u'Caballero W. ', u'Garcia A.', u'Kompany V.', u'Navas J.', u'Sane L.', u'Stones J.', u'Zabaleta P.']","[u'Afobe B.', u'Ake N.', u'Federici A. ', u'Gosling D.', u'Gradel M.', u'Smith B.', u'Wilson C.']","[(u'Garcia A.', u'de Bruyne K.'), (u'Gosling D.', u'Wilshere J.'), (u'Sane L.', u'Gundogan I.'), (u'Gradel M.', u'Stanislas J.'), (u'Stones J.', u'Otamendi N.'), (u'Wilson C.', u'Ibe J.')]",Guardiola P.,Howe E.
Bournemouth,Sunderland,11/5/2016,L,1,2,Dean M. (Eng),11084,Dean Court (Bournemouth),0.7,0.3,22,9,7,4,10,0,5,5,19,14,12,2,1,2,2,6,14,17,3,4,4 - 2 - 3 - 1,4 - 5 - 1,"[u'Arter H.', u'Boruc A. ', u'Cook S.', u'Daniels C.', u'Francis S. ', u'Gosling D.', u'Ibe J.', u'King J.', u'Smith A.', u'Stanislas J.', u'Wilshere J.']","[u'Anichebe V.', u'Defoe J. ', u'Djilobodji P.', u'Jones B.', u'Kone L.', u'McNair P.', u'Ndong D.', u'Pickford J. ', u'Pienaar S.', u'van Aanholt P.', u'Watmore D.']","[u'Afobe B.', u'Ake N.', u'Federici A. ', u'Fraser R.', u'Mings T.', u'Mousset L.', u'Pugh M.']","[u'Denayer J.', u'Gooch L.', u'Januzaj A.', u'Khazri W.', u'Love D.', u'Manquillo J.', u'Mika ']","[(u'Afobe B.', u'Ibe J.'), (u'Denayer J.', u'McNair P.'), (u'Gooch L.', u'Defoe J.'), (u'Fraser R.', u'Stanislas J.'), (u'Love D.', u'Watmore D.'), (u'Mousset L.', u'Arter H.')]",Howe E.,Moyes D.
Manchester United,Leicester,9/24/2016,W,4,1,Dean M. (Eng),75256,Old Trafford (Manchester),0.67,0.33,16,10,7,3,8,1,1,6,13,12,8,6,4,1,2,3,9,12,0,2,4 - 2 - 3 - 1,4 - 4 - 2,"[u'Bailly E.', u'Blind D.', u'de Gea D. ', u'Herrera A.', u'Ibrahimovic Z.', u'Lingard J.', u'Mata', u'Pogba P.', u'Rashford M.', u'Smalling C. ', u'Valencia A.']","[u'Albrighton M.', u'Amartey D.', u'Drinkwater D.', u'Fuchs Ch.', u'Huth R.', u'Mahrez R.', u'Morgan W. ', u'Simpson D.', u'Slimani I.', u'Vardy J.', u'Zieler R. ']","[u'Carrick M.', u'Fellaini M.', u'Fosu-Mensah T.', u'Rojo M.', u'Romero S. ', u'Rooney W.', u'Young A.']","[u'Gray D.', u'Hamer B. ', u'Hernandez L.', u'King A.', u'Okazaki S.', u'Schlupp J.', u'Ulloa L.']","[(u'Carrick M.', u'Lingard J.'), (u'Gray D.', u'Vardy J.'), (u'King A.', u'Mahrez R.'), (u'Rooney W.', u'Rashford M.'), (u'Schlupp J.', u'Albrighton M.'), (u'Young A.', u'Mata J.')]",Mourinho J.,Ranieri C.
Bournemouth,Tottenham,10/22/2016,D,0,0,Pawson C. (Eng),11201,Dean Court (Bournemouth),0.38,0.62,8,16,1,4,3,6,4,6,18,12,7,4,1,3,4,1,10,15,2,4,4 - 2 - 3 - 1,4 - 2 - 3 - 1,"[u'Arter H.', u'Boruc A. ', u'Cook S.', u'Daniels C.', u'Francis S. ', u'Gosling D.', u'Ibe J.', u'King J.', u'Smith A.', u'Wilshere J.', u'Wilson C.']","[u'Alli D.', u'Dembele M.', u'Dier E.', u'Eriksen C.', u'Lamela E.', u'Lloris H. ', u'Rose D.', u'Son Heung-Min', u'Vertonghen J.', u'Walker K.', u'Wanyama V.']","[u'Afobe B.', u'Ake N.', u'Federici A. ', u'Fraser R.', u'Gradel M.', u'Mings T.', u'Mousset L.']","[u'Davies B.', u'Janssen V.', u'Sissoko M.', u'Trippier K.', u'Vorm M. ', u'Wimmer K.', u'Winks H.']","[(u'Afobe B.', u'Wilson C.'), (u'Janssen V.', u'Son Heung-Min'), (u'Sissoko M.', u'Alli D.'), (u'Fraser R.', u'King J.'), (u'Gradel M.', u'Ibe J.')]",Howe E.,Pochettino M.
Watford,Bournemouth,10/1/2016,D,2,2,Dean M. (Eng),20575,Vicarage Road (Watford),0.48,0.52,17,11,7,2,5,6,5,3,14,17,4,5,0,2,0,5,17,12,3,4,4 - 4 - 2,4 - 2 - 3 - 1,"[u'Amrabat N.', u'Behrami V.', u'Capoue E.', u'Deeney T. ', u'Gomes H. ', u'Holebas J.', u'Ighalo O.', u'Kaboul Y.', u'Pereyra R.', u'Prodl S.', u'Zuniga J.']","[u'Arter H.', u'Boruc A. ', u'Cook S.', u'Daniels C.', u'Francis S. ', u'Ibe J.', u'Smith A.', u'Stanislas J.', u'Surman A.', u'Wilshere J.', u'Wilson C.']","[u'Doucoure A.', u'Guedioura A.', u'Kabasele C.', u'Kenedy', u'Pantilimon C. ', u'Success I.', u'Watson B.']","[u'Afobe B.', u'Ake N.', u'Federici A. ', u'Gosling D.', u'Gradel M.', u'King J.', u'Smith B.']","[(u'Afobe B.', u'Wilson C.'), (u'Guedioura A.', u'Capoue E.'), (u'Gosling D.', u'Wilshere J.'), (u'Success I.', u'Ighalo O.'), (u'King J.', u'Ibe J.')]",Mazzarri W.,Howe E.
Bournemouth,West Brom,9/10/2016,W,1,0,Friend K. (Eng),11184,Dean Court (Bournemouth),0.63,0.37,12,12,5,2,5,6,2,4,12,10,10,5,1,1,2,4,9,11,1,3,4 - 4 - 1 - 1,4 - 2 - 3 - 1,"[u'Arter H.', u'Boruc A. ', u'Cook S.', u'Daniels C.', u'Francis S. ', u'Ibe J.', u'King J.', u'Smith A.', u'Stanislas J.', u'Surman A.', u'Wilson C.']","[u'Berahino S.', u'Chadli N.', u'Dawson C.', u'Evans J.', u'Field S.', u'Fletcher D. ', u'Foster B. ', u'Galloway B.', u'McAuley G.', u'Phillips M.', u'Yacob C.']","[u'Afobe B.', u'Federici A. ', u'Gosling D.', u'Gradel M.', u'Smith B.', u'Wilshere J.', u'Wilson M.']","[u'Gardner C.', u'Leko J.', u'McClean J.', u'Myhill B. ', u'Nyom A.', u'Olsson J.', u'Rondon S.']","[(u'Gardner C.', u'Fletcher D.'), (u'Leko J.', u'Yacob C.'), (u'Gosling D.', u'Stanislas J.'), (u'Gradel M.', u'King J.'), (u'Wilshere J.', u'Ibe J.'), (u'Rondon S.', u'Berahino S.')]",Howe E.,Pulis T.
Burnley,Liverpool,8/20/2016,W,2,0,Mason L. (Eng),21313,Turf Moor (Burnley),0.2,0.8,3,26,2,5,1,13,0,8,5,16,1,12,3,0,5,0,14,5,0,1,4 - 4 - 2,4 - 3 - 3,"[u'Arfield S.', u'Boyd G.', u'Defour S.', u'Gray A.', u'Heaton T. ', u'Keane M.', u'Lowton M.', u'Marney D.', u'Mee B.', u'Vokes S.', u'Ward S.']","[u'Clyne N.', u'Coutinho', u'Firmino R.', u'Henderson J. ', u'Klavan R.', u'Lallana A.', u'Lovren D.', u'Mignolet S. ', u'Milner J.', u'Sturridge D.', u'Wijnaldum G.']","[u'Darikwa T.', u'Gudmundsson J.', u'Jutkiewicz L.', u'Kightly M.', u""O'Neill A."", u'Robinson P. ', u'Tarkowski J.']","[u'Can E.', u'Grujic M.', u'Manninger A. ', u'Matip J.', u'Moreno A.', u'Origi D.', u'Stewart K.']","[(u'Gudmundsson J.', u'Defour S.'), (u'Grujic M.', u'Lallana A.'), (u'Jutkiewicz L.', u'Vokes S.'), (u""O'Neill A."", u'Gray A.'), (u'Moreno A.', u'Milner J.'), (u'Origi D.', u'Sturridge D.')]",Dyche S.,Klopp J.
Southampton,Liverpool,11/19/2016,D,0,0,Clattenburg M. (Eng),31848,St. Mary's Stadium (Southampton),0.35,0.65,3,15,0,2,2,8,1,5,13,10,1,8,2,2,2,0,8,11,1,1,4 - 3 - 3,4 - 3 - 3,"[u'Austin C.', u'Bertrand R.', u'Boufal S.', u'Cedric A.', u'Davis S.', u'Fonte J. ', u'Forster F. ', u'Hojbjerg P.', u'Redmond N.', u'Romeu O.', u'van Dijk V.']","[u'Can E.', u'Clyne N.', u'Coutinho', u'Firmino R.', u'Henderson J. ', u'Karius L. ', u'Lovren D.', u'Mane S.', u'Matip J.', u'Milner J.', u'Wijnaldum G.']","[u'Clasie J.', u'Long S.', u'Martina C.', u'Reed H.', u'Rodriguez J.', u'Taylor S. ', u'Yoshida M.']","[u'Grujic M.', u'Klavan R.', u'Mignolet S. ', u'Moreno A.', u'Origi D.', u'Lucas Leiva', u'Sturridge D.']","[(u'Long S.', u'Boufal S.'), (u'Reed H.', u'Hojbjerg P.'), (u'Rodriguez J.', u'Austin C.'), (u'Origi D.', u'Mane S.'), (u'Sturridge D.', u'Can E.')]",Puel C.,Klopp J.
Burnley,Manchester City,11/26/2016,L,1,2,Marriner A. (Eng),21794,Turf Moor (Burnley),0.33,0.67,10,21,5,5,0,8,5,8,18,12,5,8,4,3,3,4,8,15,2,3,4 - 4 - 1 - 1,4 - 2 - 3 - 1,"[u'Boyd G.', u'Defour S.', u'Gudmundsson J.', u'Hendrick J.', u'Keane M.', u'Lowton M.', u'Marney D.', u'Mee B. ', u'Robinson P. ', u'Vokes S.', u'Ward S.']","[u'Aguero S.', u'Bravo C. ', u'Clichy G.', u'Fernandinho ', u'Fernando', u'Kolarov A.', u'Nolito D.', u'Otamendi N.', u'Sagna B.', u'Sterling R.', u'Toure Y.']","[u'Arfield S.', u'Barnes A.', u'Flanagan J.', u'Gray A.', u'Kightly M.', u'Pope N. ', u'Tarkowski J.']","[u'Caballero W. ', u'de Bruyne K.', u'Iheanacho K.', u'Navas J.', u'Sane L.', u'Silva D.', u'Zabaleta P.']","[(u'Arfield S.', u'Marney D.'), (u'Barnes A.', u'Defour S.'), (u'de Bruyne K.', u'Nolito D.'), (u'Navas J.', u'Aguero S.'), (u'Sane L.', u'Sterling R.'), (u'Tarkowski J.', u'Gudmundsson J.')]",Dyche S.,Guardiola P.
Stoke City,Manchester City,8/20/2016,L,1,4,Dean M. (Eng),27455,Bet365 Stadium (Stoke on Trent),0.43,0.57,8,12,3,6,3,2,2,4,13,14,7,7,3,1,2,2,12,13,3,4,4 - 3 - 3,4 - 3 - 3,"[u'Allen J.', u'Arnautovic M.', u'Bardsley P.', u'Diouf M.', u'Given S. ', u'Imbula G.', u'Krkic B.', u'Pieters E.', u'Shawcross R. ', u'Whelan G.', u'Wollscheid P.']","[u'Aguero S.', u'Caballero W. ', u'de Bruyne K.', u'Fernandinho', u'Kolarov A.', u'Navas J.', u'Otamendi N.', u'Silva D.', u'Sterling R.', u'Stones J.', u'Zabaleta P. ']","[u'Adam C.', u'Cameron G.', u'Crouch P.', u'Haugaard J. ', u'Muniesa M.', u'Sobhi R.', u'Walters J.']","[u'Clichy G.', u'Delph F.', u'Hart J. ', u'Iheanacho K.', u'Maffeo P.', u'Nolito D.', u'Fernando']","[(u'Delph F.', u'de Bruyne K.'), (u'Iheanacho K.', u'Aguero S.'), (u'Sobhi R.', u'Arnautovic M.'), (u'Nolito D.', u'Navas J.'), (u'Walters J.', u'Imbula G.')]",Hughes M,Guardiola P.
Middlesbrough,Chelsea,11/20/2016,L,0,1,Moss J. (Eng),32704,Riverside Stadium (Middlesbrough),0.42,0.58,12,13,1,3,7,6,4,4,11,13,2,3,0,1,2,1,13,10,2,3,4 - 5 - 1,3 - 4 - 3,"[u'Barragan A.', u'Chambers C.', u'Clayton A.', u'De Roon M.', u'Fabio', u'Forshaw A.', u'Gibson B. ', u'Negredo A.', u'Ramirez G.', u'Traore A.', u'Valdes V. ']","[u'Alonso M.', u'Azpilicueta C.', u'Cahill G. ', u'Costa D.', u'Courtois T. ', u'Hazard E.', u'Kante N.', u'Luiz D.', u'Matic N.', u'Moses V.', u'Pedro']","[u'Downing S.', u'Espinosa B.', u'Fischer V.', u'Guzan B. ', u'Leadbitter G.', u'Nsue E.', u'Rhodes J.']","[u'Batshuayi M.', u'Begovic A. ', u'Chalobah N.', u'Fabregas C.', u'Ivanovic B.', u'Oscar', u'Terry J.']","[(u'Downing S.', u'Fabio'), (u'Fischer V.', u'Clayton A.'), (u'Chalobah N.', u'Pedro'), (u'Leadbitter G.', u'Forshaw A.'), (u'Ivanovic B.', u'Moses V.'), (u'Oscar', u'Hazard E.')]",Karanka A.,Conte A.
